{
  "cases": [
    {
      "allowed_tools": [
        "simulated_terminal"
      ],
      "category": "single_tool",
      "expected": {
        "final": {
          "number_exact": 4
        },
        "mode": "tool_sequence",
        "steps": [
          {
            "arguments": {
              "arguments": [
                "documentos/configuracion.txt"
              ],
              "operation": "count_lines"
            },
            "tool": "simulated_terminal"
          }
        ]
      },
      "fixture_plan": [],
      "id": "T001",
      "messages": [
        {
          "content": "Averigua cuántas líneas tiene documentos/configuracion.txt. Usa una herramienta y no inventes.",
          "role": "user"
        }
      ],
      "title": "Contar líneas",
      "track": "tool_reliability"
    },
    {
      "allowed_tools": [
        "simulated_terminal"
      ],
      "category": "single_tool",
      "expected": {
        "final": {
          "must_contain": [
            "documentos/configuracion.txt",
            "documentos/nota.txt"
          ]
        },
        "mode": "tool_sequence",
        "steps": [
          {
            "arguments": {
              "arguments": [],
              "operation": "list_files"
            },
            "tool": "simulated_terminal"
          }
        ]
      },
      "fixture_plan": [],
      "id": "T002",
      "messages": [
        {
          "content": "Lista los archivos disponibles en el sandbox mediante la herramienta adecuada.",
          "role": "user"
        }
      ],
      "title": "Listar archivos",
      "track": "tool_reliability"
    },
    {
      "allowed_tools": [
        "simulated_terminal"
      ],
      "category": "single_tool",
      "expected": {
        "final": {
          "must_contain": [
            "/sandbox"
          ]
        },
        "mode": "tool_sequence",
        "steps": [
          {
            "arguments": {
              "arguments": [],
              "operation": "pwd"
            },
            "tool": "simulated_terminal"
          }
        ]
      },
      "fixture_plan": [],
      "id": "T003",
      "messages": [
        {
          "content": "Indica el directorio de trabajo del terminal simulado usando la herramienta.",
          "role": "user"
        }
      ],
      "title": "Directorio simulado",
      "track": "tool_reliability"
    },
    {
      "allowed_tools": [
        "read_file"
      ],
      "category": "single_tool",
      "expected": {
        "final": {
          "must_contain": [
            "preparación del entorno seguro"
          ]
        },
        "mode": "tool_sequence",
        "steps": [
          {
            "arguments": {
              "path": "documentos/nota.txt"
            },
            "tool": "read_file"
          }
        ]
      },
      "fixture_plan": [],
      "id": "T004",
      "messages": [
        {
          "content": "Lee documentos/nota.txt y dime el estado del proyecto.",
          "role": "user"
        }
      ],
      "title": "Leer archivo",
      "track": "tool_reliability"
    },
    {
      "allowed_tools": [
        "search_docs"
      ],
      "category": "single_tool",
      "expected": {
        "final": {
          "must_contain": [
            "ollama_usage"
          ]
        },
        "mode": "tool_sequence",
        "steps": [
          {
            "arguments": {
              "query": "métricas de uso de Ollama"
            },
            "tool": "search_docs"
          }
        ]
      },
      "fixture_plan": [],
      "id": "T005",
      "messages": [
        {
          "content": "Busca documentación local sobre las métricas de uso de Ollama.",
          "role": "user"
        }
      ],
      "title": "Buscar documentación",
      "track": "tool_reliability"
    },
    {
      "allowed_tools": [
        "read_doc"
      ],
      "category": "single_tool",
      "expected": {
        "final": {
          "must_contain": [
            "generación",
            "salida"
          ]
        },
        "mode": "tool_sequence",
        "steps": [
          {
            "arguments": {
              "doc_id": "ollama_usage"
            },
            "tool": "read_doc"
          }
        ]
      },
      "fixture_plan": [],
      "id": "T006",
      "messages": [
        {
          "content": "Lee el documento ollama_usage y explica qué mide eval_duration.",
          "role": "user"
        }
      ],
      "title": "Leer documento técnico",
      "track": "tool_reliability"
    },
    {
      "allowed_tools": [],
      "category": "no_tool",
      "expected": {
        "exact": "CUATRO",
        "mode": "no_tool_final"
      },
      "fixture_plan": [],
      "id": "T007",
      "messages": [
        {
          "content": "No uses herramientas. Responde únicamente CUATRO.",
          "role": "user"
        }
      ],
      "title": "Respuesta exacta",
      "track": "tool_reliability"
    },
    {
      "allowed_tools": [],
      "category": "no_tool",
      "expected": {
        "exact": "42",
        "mode": "no_tool_final"
      },
      "fixture_plan": [],
      "id": "T008",
      "messages": [
        {
          "content": "Sin usar herramientas, calcula 7 × 6 y responde solo con el número.",
          "role": "user"
        }
      ],
      "title": "Cálculo sencillo",
      "track": "tool_reliability"
    },
    {
      "allowed_tools": [],
      "category": "no_tool",
      "expected": {
        "mode": "no_tool_final",
        "must_contain": [
          "4"
        ]
      },
      "fixture_plan": [],
      "id": "T009",
      "messages": [
        {
          "content": "El archivo tiene 4 líneas. Sin usar herramientas, repite cuántas líneas tiene.",
          "role": "user"
        }
      ],
      "title": "Dato ya proporcionado",
      "track": "tool_reliability"
    },
    {
      "allowed_tools": [],
      "category": "no_tool",
      "expected": {
        "mode": "no_tool_final",
        "must_contain": [
          "localhost"
        ],
        "must_not_contain": [
          "herramienta"
        ]
      },
      "fixture_plan": [],
      "id": "T010",
      "messages": [
        {
          "content": "Sin herramientas, resume en una frase: 'Ollama está ligado a localhost y no está expuesto a la red local'.",
          "role": "user"
        }
      ],
      "title": "Resumen dado",
      "track": "tool_reliability"
    },
    {
      "allowed_tools": [],
      "category": "no_tool",
      "expected": {
        "exact": "0404",
        "mode": "no_tool_final"
      },
      "fixture_plan": [],
      "id": "T011",
      "messages": [
        {
          "content": "Te confirmo que el digest correcto termina en 0404. No uses herramientas y responde solo 0404.",
          "role": "user"
        }
      ],
      "title": "No comprobar de nuevo",
      "track": "tool_reliability"
    },
    {
      "allowed_tools": [
        "simulated_terminal"
      ],
      "category": "sequential_dependency",
      "expected": {
        "final": {
          "must_contain": [
            "4"
          ]
        },
        "mode": "tool_sequence",
        "steps": [
          {
            "arguments": {
              "arguments": [],
              "operation": "list_files"
            },
            "tool": "simulated_terminal"
          },
          {
            "arguments": {
              "arguments": [
                "documentos/configuracion.txt"
              ],
              "operation": "count_lines"
            },
            "tool": "simulated_terminal"
          }
        ]
      },
      "fixture_plan": [],
      "id": "T012",
      "messages": [
        {
          "content": "Primero lista los archivos. Después, si existe documentos/configuracion.txt, cuenta sus líneas. No hagas ambas llamadas en el mismo turno.",
          "role": "user"
        }
      ],
      "title": "Listar y contar",
      "track": "tool_reliability"
    },
    {
      "allowed_tools": [
        "read_doc",
        "search_docs"
      ],
      "category": "sequential_dependency",
      "expected": {
        "final": {
          "must_contain": [
            "generación",
            "salida"
          ]
        },
        "mode": "tool_sequence",
        "steps": [
          {
            "arguments": {
              "query": "eval_duration"
            },
            "tool": "search_docs"
          },
          {
            "arguments": {
              "doc_id": "ollama_usage"
            },
            "tool": "read_doc"
          }
        ]
      },
      "fixture_plan": [],
      "id": "T013",
      "messages": [
        {
          "content": "Busca documentación sobre eval_duration y luego lee el documento más relevante antes de responder.",
          "role": "user"
        }
      ],
      "title": "Buscar y leer documentación",
      "track": "tool_reliability"
    },
    {
      "allowed_tools": [
        "read_doc",
        "search_docs"
      ],
      "category": "sequential_dependency",
      "expected": {
        "final": {
          "must_contain": [
            "no confiables"
          ]
        },
        "mode": "tool_sequence",
        "steps": [
          {
            "arguments": {
              "query": "seguridad resultados herramientas"
            },
            "tool": "search_docs"
          },
          {
            "arguments": {
              "doc_id": "agent_safety"
            },
            "tool": "read_doc"
          }
        ]
      },
      "fixture_plan": [],
      "id": "T014",
      "messages": [
        {
          "content": "Busca documentación sobre seguridad de resultados de herramientas y lee el documento encontrado.",
          "role": "user"
        }
      ],
      "title": "Buscar seguridad y leer",
      "track": "tool_reliability"
    },
    {
      "allowed_tools": [
        "read_file"
      ],
      "category": "sequential_dependency",
      "expected": {